<?xml version="1.0" encoding="UTF-8" standalone="no" ?>
<index xmlns:xsi="http://www.w3.org/2001/XMLSchema-instance" xsi:noNamespaceSchemaLocation="index.xsd">

  <info enigma="1.00" group="Enigma" location="700" network="false" owner="Enigma Team" release="1" revision="1" title="Enigma VI"/>

  <attributes/>

  <levels>
    <level _seq="1" _title="Welcome" _xpath="./welcometopack6_1" author="Raoul Bourquin" ctrl="force" easy="false" id="welcometopack6" rel="1" rev="0" score="1" target="time" unit="duration"/>
    <level _seq="2" _title="A-way" _xpath="./richi06_1" author="Richi" ctrl="force" easy="false" id="richi06" rel="1" rev="0" score="1" target="time" unit="duration"/>
    <level _seq="3" _title="Toreador" _xpath="./ral02_1" author="Ronald Lamprecht" ctrl="force" easy="true" id="20060213ral004" rel="1" rev="25" score="1" target="time" unit="duration"/>
    <level _seq="4" _title="Laser Splitting" _xpath="./luc29_1" author="Lukas Schueller" ctrl="force" easy="false" id="luc29" rel="1" rev="0" score="1" target="time" unit="duration"/>
    <level _seq="5" _title="Oxydrings" _xpath="./raoul13_1" author="Raoul Bourquin" ctrl="force" easy="false" id="raoul13" rel="1" rev="0" score="1" target="time" unit="duration"/>
    <level _seq="6" _title="Pac Marble" _xpath="./andreas22_1" author="Andreas Lochmann" ctrl="force" easy="false" id="andreas22" rel="1" rev="0" score="1" target="time" unit="duration"/>
    <level _seq="7" _title="Basketball" _xpath="./ral03_2" author="Ronald Lamprecht" ctrl="force" easy="true" id="20060213ral005" rel="2" rev="25" score="2" target="time" unit="duration"/>
    <level _seq="8" _title="Take the Earth" _xpath="./andreas26_1" author="Andreas Lochmann" ctrl="force" easy="true" id="andreas26" rel="1" rev="0" score="1" target="time" unit="duration"/>
    <level _seq="9" _title="Evil" _xpath="./spaceman04_1" author="Spaceman" ctrl="force" easy="false" id="spaceman4" rel="1" rev="0" score="1" target="time" unit="duration"/>
    <level _seq="10" _title="Meditation Disturbance" _xpath="./ral04_1" author="Ronald Lamprecht" ctrl="force" easy="true" id="20060429ral006" rel="1" rev="25" score="1" target="time" unit="duration"/>
    <level _seq="11" _title="Im-pull-se" _xpath="./ralf07_1" author="Ralf Westram" ctrl="force" easy="false" id="ralf07" rel="1" rev="0" score="1" target="time" unit="duration"/>
    <level _seq="12" _title="Zeus" _xpath="./raoul19_1" author="Raoul Bourquin" ctrl="force" easy="true" id="raoul19" rel="1" rev="0" score="1" target="time" unit="duration"/>
    <level _seq="13" _title="Rhapsody on Cracks" _xpath="./ral06_1" author="Ronald Lamprecht" ctrl="force" easy="true" id="20060510ral008" rel="1" rev="25" score="1" target="time" unit="duration"/>
    <level _seq="14" _title="Prepare Your Defense" _xpath="./duffy132_1" author="Jacob Scott" ctrl="force" easy="false" id="duffy132" rel="1" rev="0" score="1" target="time" unit="duration"/>
    <level _seq="15" _title="Cold Way" _xpath="./raoul21_1" author="Raoul Bourquin" ctrl="force" easy="false" id="raoul21" rel="1" rev="0" score="1" target="time" unit="duration"/>
    <level _seq="16" _title="Laserpowered" _xpath="./raoul20_1" author="Raoul Bourquin" ctrl="force" easy="true" id="raoul20" rel="1" rev="0" score="1" target="time" unit="duration"/>
    <level _seq="17" _title="Oxydmoron" _xpath="./raoul14_1" author="Raoul Bourquin" ctrl="force" easy="true" id="raoul14" rel="1" rev="0" score="1" target="time" unit="duration"/>
    <level _seq="18" _title="Bomb raider" _xpath="./alain27_1" author="Alain Busser" ctrl="force" easy="true" id="alain27" rel="1" rev="0" score="1" target="time" unit="duration"/>
    <level _seq="19" _title="Dancing on Light Beams" _xpath="./andreas28_1" author="Andreas Lochmann" ctrl="force" easy="false" id="andreas28" rel="1" rev="0" score="1" target="time" unit="duration"/>
    <level _seq="20" _title="- Meditation -" _xpath="./alain25_1" author="Alain Busser + Raoul Bourquin" ctrl="force" easy="false" id="alain25" rel="1" rev="0" score="1" target="time" unit="duration"/>
    <level _seq="21" _title="ZigZag" _xpath="./ralf06_1" author="Ralf Westram" ctrl="force" easy="true" id="ralf06" rel="1" rev="0" score="1" target="time" unit="duration"/>
    <level _seq="22" _title="Just Stay Calm" _xpath="./duffy116_1" author="Jacob Scott" ctrl="force" easy="false" id="duffy116" rel="1" rev="0" score="1" target="time" unit="duration"/>
    <level _seq="23" _title="Checkmate I" _xpath="./andreas29_1" author="Andreas Lochmann" ctrl="force" easy="false" id="andreas29" rel="1" rev="0" score="1" target="time" unit="duration"/>
    <level _seq="24" _title="The Stable" _xpath="./andreas30_1" author="Andreas Lochmann" ctrl="force" easy="false" id="andreas30" rel="1" rev="0" score="1" target="time" unit="duration"/>
    <level _seq="25" _title="Chess, Bugs &amp; Rock'n'Roll" _xpath="./andreas31_1" author="Andreas Lochmann" ctrl="force" easy="false" id="andreas31" rel="1" rev="0" score="1" target="time" unit="duration"/>
    <level _seq="26" _title="Chessing Positions" _xpath="./raoul22_1" author="Raoul Bourquin" ctrl="force" easy="false" id="raoul22" rel="1" rev="0" score="1" target="time" unit="duration"/>
    <level _seq="27" _title="Just a Maze?" _xpath="./duffy12_1" author="Jacob Scott" ctrl="force" easy="false" id="duffy12" rel="1" rev="0" score="1" target="time" unit="duration"/>
    <level _seq="28" _title="pool with a pole" _xpath="./alain23_1" author="Alain Busser" ctrl="force" easy="false" id="alain23" rel="1" rev="0" score="1" target="time" unit="duration"/>
    <level _seq="29" _title="Hot Meditation" _xpath="./ral08_1" author="Ronald Lamprecht" ctrl="force" easy="true" id="20060527ral010" rel="1" rev="26" score="1" target="time" unit="duration"/>
  </levels>

</index>
