<?xml version="1.0" encoding="UTF-8" standalone="no" ?>
<index xmlns:xsi="http://www.w3.org/2001/XMLSchema-instance" xsi:noNamespaceSchemaLocation="index.xsd">

  <info enigma="1.00" group="Sokoban" location="4200" network="false" owner="Enigma Team" release="1" revision="1" title="Microban"/>

  <attributes/>

  <levels>
    <level _seq="1" _title="Microban 58" _xpath="./mic_58" author="David W Skinner" ctrl="force" easy="false" id="microban/mic_58" rel="1" rev="0" score="1" target="time" unit="duration"/>
    <level _seq="2" _title="Microban 60" _xpath="./mic_60" author="David W Skinner" ctrl="force" easy="false" id="microban/mic_60" rel="1" rev="0" score="1" target="time" unit="duration"/>
    <level _seq="3" _title="Microban 61" _xpath="./mic_61" author="David W Skinner" ctrl="force" easy="false" id="microban/mic_61" rel="1" rev="0" score="1" target="time" unit="duration"/>
    <level _seq="4" _title="Microban 62" _xpath="./mic_62" author="David W Skinner" ctrl="force" easy="false" id="microban/mic_62" rel="1" rev="0" score="1" target="time" unit="duration"/>
    <level _seq="5" _title="Microban 63" _xpath="./mic_63" author="David W Skinner" ctrl="force" easy="false" id="microban/mic_63" rel="1" rev="0" score="1" target="time" unit="duration"/>
    <level _seq="6" _title="Microban 64" _xpath="./mic_64" author="David W Skinner" ctrl="force" easy="false" id="microban/mic_64" rel="1" rev="0" score="1" target="time" unit="duration"/>
    <level _seq="7" _title="Microban 65" _xpath="./mic_65" author="David W Skinner" ctrl="force" easy="false" id="microban/mic_65" rel="1" rev="0" score="1" target="time" unit="duration"/>
    <level _seq="8" _title="Microban 67" _xpath="./mic_67" author="David W Skinner" ctrl="force" easy="false" id="microban/mic_67" rel="1" rev="0" score="1" target="time" unit="duration"/>
    <level _seq="9" _title="Microban 68" _xpath="./mic_68" author="David W Skinner" ctrl="force" easy="false" id="microban/mic_68" rel="1" rev="0" score="1" target="time" unit="duration"/>
    <level _seq="10" _title="Microban 69" _xpath="./mic_69" author="David W Skinner" ctrl="force" easy="false" id="microban/mic_69" rel="1" rev="0" score="1" target="time" unit="duration"/>
    <level _seq="11" _title="Microban 74" _xpath="./mic_74" author="David W Skinner" ctrl="force" easy="false" id="microban/mic_74" rel="1" rev="0" score="1" target="time" unit="duration"/>
    <level _seq="12" _title="Microban 78" _xpath="./mic_78" author="David W Skinner" ctrl="force" easy="false" id="microban/mic_78" rel="1" rev="0" score="1" target="time" unit="duration"/>
    <level _seq="13" _title="Microban 79" _xpath="./mic_79" author="David W Skinner" ctrl="force" easy="false" id="microban/mic_79" rel="1" rev="0" score="1" target="time" unit="duration"/>
    <level _seq="14" _title="Microban 83" _xpath="./mic_83" author="David W Skinner" ctrl="force" easy="false" id="microban/mic_83" rel="1" rev="0" score="1" target="time" unit="duration"/>
    <level _seq="15" _title="Microban 86" _xpath="./mic_86" author="David W Skinner" ctrl="force" easy="false" id="microban/mic_86" rel="1" rev="0" score="1" target="time" unit="duration"/>
    <level _seq="16" _title="Microban 93" _xpath="./mic_93" author="David W Skinner" ctrl="force" easy="false" id="microban/mic_93" rel="1" rev="0" score="1" target="time" unit="duration"/>
    <level _seq="17" _title="Microban 100" _xpath="./mic_100" author="David W Skinner" ctrl="force" easy="false" id="microban/mic_100" rel="1" rev="0" score="1" target="time" unit="duration"/>
    <level _seq="18" _title="Microban 101" _xpath="./mic_101" author="David W Skinner" ctrl="force" easy="false" id="microban/mic_101" rel="1" rev="0" score="1" target="time" unit="duration"/>
    <level _seq="19" _title="Microban 102" _xpath="./mic_102" author="David W Skinner" ctrl="force" easy="false" id="microban/mic_102" rel="1" rev="0" score="1" target="time" unit="duration"/>
    <level _seq="20" _title="Microban 103" _xpath="./mic_103" author="David W Skinner" ctrl="force" easy="false" id="microban/mic_103" rel="1" rev="0" score="1" target="time" unit="duration"/>
    <level _seq="21" _title="Microban 104" _xpath="./mic_104" author="David W Skinner" ctrl="force" easy="false" id="microban/mic_104" rel="1" rev="0" score="1" target="time" unit="duration"/>
    <level _seq="22" _title="Microban 105" _xpath="./mic_105" author="David W Skinner" ctrl="force" easy="false" id="microban/mic_105" rel="2" rev="0" score="2" target="time" unit="duration"/>
    <level _seq="23" _title="Microban 106" _xpath="./mic_106" author="David W Skinner" ctrl="force" easy="false" id="microban/mic_106" rel="1" rev="0" score="1" target="time" unit="duration"/>
    <level _seq="24" _title="Microban 107" _xpath="./mic_107" author="David W Skinner" ctrl="force" easy="false" id="microban/mic_107" rel="1" rev="0" score="1" target="time" unit="duration"/>
    <level _seq="25" _title="Microban 108" _xpath="./mic_108" author="David W Skinner" ctrl="force" easy="false" id="microban/mic_108" rel="1" rev="0" score="1" target="time" unit="duration"/>
    <level _seq="26" _title="Microban 110" _xpath="./mic_110" author="David W Skinner" ctrl="force" easy="false" id="microban/mic_110" rel="1" rev="0" score="1" target="time" unit="duration"/>
    <level _seq="27" _title="Microban 113" _xpath="./mic_113" author="David W Skinner" ctrl="force" easy="false" id="microban/mic_113" rel="1" rev="0" score="1" target="time" unit="duration"/>
    <level _seq="28" _title="Microban 114" _xpath="./mic_114" author="David W Skinner" ctrl="force" easy="false" id="microban/mic_114" rel="1" rev="0" score="1" target="time" unit="duration"/>
    <level _seq="29" _title="Microban 115" _xpath="./mic_115" author="David W Skinner" ctrl="force" easy="false" id="microban/mic_115" rel="1" rev="0" score="1" target="time" unit="duration"/>
    <level _seq="30" _title="Microban 117" _xpath="./mic_117" author="David W Skinner" ctrl="force" easy="false" id="microban/mic_117" rel="1" rev="0" score="1" target="time" unit="duration"/>
    <level _seq="31" _title="Microban 118" _xpath="./mic_118" author="David W Skinner" ctrl="force" easy="false" id="microban/mic_118" rel="1" rev="0" score="1" target="time" unit="duration"/>
    <level _seq="32" _title="Microban 121" _xpath="./mic_121" author="David W Skinner" ctrl="force" easy="false" id="microban/mic_121" rel="1" rev="0" score="1" target="time" unit="duration"/>
    <level _seq="33" _title="Microban 123" _xpath="./mic_123" author="David W Skinner" ctrl="force" easy="false" id="microban/mic_123" rel="1" rev="0" score="1" target="time" unit="duration"/>
    <level _seq="34" _title="Microban 127" _xpath="./mic_127" author="David W Skinner" ctrl="force" easy="false" id="microban/mic_127" rel="1" rev="0" score="1" target="time" unit="duration"/>
    <level _seq="35" _title="Microban 132" _xpath="./mic_132" author="David W Skinner" ctrl="force" easy="false" id="microban/mic_132" rel="1" rev="0" score="1" target="time" unit="duration"/>
    <level _seq="36" _title="Microban 133" _xpath="./mic_133" author="David W Skinner" ctrl="force" easy="false" id="microban/mic_133" rel="1" rev="0" score="1" target="time" unit="duration"/>
    <level _seq="37" _title="Microban 135" _xpath="./mic_135" author="David W Skinner" ctrl="force" easy="false" id="microban/mic_135" rel="1" rev="0" score="1" target="time" unit="duration"/>
    <level _seq="38" _title="Microban 136" _xpath="./mic_136" author="David W Skinner" ctrl="force" easy="false" id="microban/mic_136" rel="1" rev="0" score="1" target="time" unit="duration"/>
    <level _seq="39" _title="Microban 138" _xpath="./mic_138" author="David W Skinner" ctrl="force" easy="false" id="microban/mic_138" rel="1" rev="0" score="1" target="time" unit="duration"/>
    <level _seq="40" _title="Microban 139" _xpath="./mic_139" author="David W Skinner" ctrl="force" easy="false" id="microban/mic_139" rel="1" rev="0" score="1" target="time" unit="duration"/>
    <level _seq="41" _title="Microban 141" _xpath="./mic_141" author="David W Skinner" ctrl="force" easy="false" id="microban/mic_141" rel="1" rev="0" score="1" target="time" unit="duration"/>
    <level _seq="42" _title="Microban 142" _xpath="./mic_142" author="David W Skinner" ctrl="force" easy="false" id="microban/mic_142" rel="1" rev="0" score="1" target="time" unit="duration"/>
    <level _seq="43" _title="Microban 143" _xpath="./mic_143" author="David W Skinner" ctrl="force" easy="false" id="microban/mic_143" rel="1" rev="0" score="1" target="time" unit="duration"/>
    <level _seq="44" _title="Microban 144" _xpath="./mic_144" author="David W Skinner" ctrl="force" easy="false" id="microban/mic_144" rel="1" rev="0" score="1" target="time" unit="duration"/>
    <level _seq="45" _title="Microban 145" _xpath="./mic_145" author="David W Skinner" ctrl="force" easy="false" id="microban/mic_145" rel="1" rev="0" score="1" target="time" unit="duration"/>
    <level _seq="46" _title="Microban 146" _xpath="./mic_146" author="David W Skinner" ctrl="force" easy="false" id="microban/mic_146" rel="1" rev="0" score="1" target="time" unit="duration"/>
    <level _seq="47" _title="Microban 150" _xpath="./mic_150" author="David W Skinner" ctrl="force" easy="false" id="microban/mic_150" rel="1" rev="0" score="1" target="time" unit="duration"/>
    <level _seq="48" _title="Microban 151" _xpath="./mic_151" author="David W Skinner" ctrl="force" easy="false" id="microban/mic_151" rel="1" rev="0" score="1" target="time" unit="duration"/>
  </levels>

</index>
